{
  "schema": "embedaiassist.netlist.v1",
  "generator": "schematic-reader",
  "eda_tool": "altium",
  "source_file": "E:\\skills\\EmbedSoftAutomaticProject\\embed-ai-assist\\examples\\ft61f14x\\schematic\\ft61f14x_test.SchDoc",
  "parse_status": "success",
  "generated_at": "2026-09-20T11:42:42",
  "statistics": {
    "component_count": 18,
    "net_count": 19,
    "pin_count": 48
  },
  "warnings": [],
  "components": [
    {
      "designator": "C1",
      "value": "2.2uF/25V",
      "footprint": "CE-1.5*4*8",
      "library_ref": "CE",
      "description": "Ö±²åµç½âµçÈÝ",
      "parameters": {
        "BOMÃû³Æ": "Ö±²åµç½âµçÈÝ",
        "Comment": "2.2uF/25V",
        "µ±Ç°¿â°æ±¾V2022.12.25 @ÌÔ±|Âô¼Ò:»Æ¾§±|Ê¯": "×îÐÂ°æ±¾·¢²¼https://shop463601444.taobao.com"
      },
      "pins": [
        {
          "pin": "1",
          "pin_name": "1",
          "pin_type": "PASSIVE",
          "net": "NetC1_1"
        },
        {
          "pin": "2",
          "pin_name": "2",
          "pin_type": "PASSIVE",
          "net": "NetC1_2"
        }
      ]
    },
    {
      "designator": "C2",
      "value": "102",
      "footprint": "C0805_L",
      "library_ref": "C",
      "description": "ÌùÆ¬µçÈÝ/MLCCµçÈÝ",
      "parameters": {
        "BOMÃû³Æ": "ÎÞ¼«ÐÔÌùÆ¬µçÈÝ",
        "Comment": "102",
        "µ±Ç°¿â°æ±¾V2022.12.25 @ÌÔ±|Âô¼Ò:»Æ¾§±|Ê¯": "×îÐÂ°æ±¾·¢²¼https://shop463601444.taobao.com"
      },
      "pins": [
        {
          "pin": "1",
          "pin_name": "1",
          "pin_type": "PASSIVE",
          "net": "NetC1_2"
        },
        {
          "pin": "2",
          "pin_name": "2",
          "pin_type": "PASSIVE",
          "net": "NetC1_1"
        }
      ]
    },
    {
      "designator": "C3",
      "value": "220uF/25V",
      "footprint": "CE-1.5*4*8",
      "library_ref": "CE",
      "description": "Ö±²åµç½âµçÈÝ",
      "parameters": {
        "BOMÃû³Æ": "Ö±²åµç½âµçÈÝ",
        "Comment": "220uF/25V",
        "µ±Ç°¿â°æ±¾V2022.12.25 @ÌÔ±|Âô¼Ò:»Æ¾§±|Ê¯": "×îÐÂ°æ±¾·¢²¼https://shop463601444.taobao.com"
      },
      "pins": [
        {
          "pin": "1",
          "pin_name": "1",
          "pin_type": "PASSIVE",
          "net": "NetC1_1"
        },
        {
          "pin": "2",
          "pin_name": "2",
          "pin_type": "PASSIVE",
          "net": "NetC1_2"
        }
      ]
    },
    {
      "designator": "C4",
      "value": "102",
      "footprint": "C0805_L",
      "library_ref": "C",
      "description": "ÌùÆ¬µçÈÝ/MLCCµçÈÝ",
      "parameters": {
        "BOMÃû³Æ": "ÎÞ¼«ÐÔÌùÆ¬µçÈÝ",
        "Comment": "102",
        "µ±Ç°¿â°æ±¾V2022.12.25 @ÌÔ±|Âô¼Ò:»Æ¾§±|Ê¯": "×îÐÂ°æ±¾·¢²¼https://shop463601444.taobao.com"
      },
      "pins": [
        {
          "pin": "1",
          "pin_name": "1",
          "pin_type": "PASSIVE",
          "net": "NetC1_2"
        },
        {
          "pin": "2",
          "pin_name": "2",
          "pin_type": "PASSIVE",
          "net": "NetC1_1"
        }
      ]
    },
    {
      "designator": "D1",
      "value": "ºìÉ«",
      "footprint": "LED0805_G",
      "library_ref": "LED",
      "description": "ÌùÆ¬LED",
      "parameters": {
        "BOMÃû³Æ": "ÌùÆ¬LED",
        "Comment": "ºìÉ«",
        "·â×°¿âÀ´×ÔÌÔ±|Âô¼Ò£º»Æ¾§±|Ê¯": "ÆäËûµêÆÌ¹ºÈë¾ùÎªµÁ°æ·â×°¿â£¬ÎÞ¸üÐÂÈ¨Òæ£¬ÇëÁ¢¼´ÉêÇëÍË¿î£¬±¾µêÏÖ½ð½±Àø200~1000Ôª"
      },
      "pins": [
        {
          "pin": "1",
          "pin_name": "A",
          "pin_type": "PASSIVE",
          "net": "NetD1_1"
        },
        {
          "pin": "2",
          "pin_name": "K",
          "pin_type": "PASSIVE",
          "net": "NetC1_2"
        }
      ]
    },
    {
      "designator": "D3",
      "value": "ÂÌÉ«",
      "footprint": "LED0805_G",
      "library_ref": "LED",
      "description": "ÌùÆ¬LED",
      "parameters": {
        "BOMÃû³Æ": "ÌùÆ¬LED",
        "Comment": "ÂÌÉ«",
        "·â×°¿âÀ´×ÔÌÔ±|Âô¼Ò£º»Æ¾§±|Ê¯": "ÆäËûµêÆÌ¹ºÈë¾ùÎªµÁ°æ·â×°¿â£¬ÎÞ¸üÐÂÈ¨Òæ£¬ÇëÁ¢¼´ÉêÇëÍË¿î£¬±¾µêÏÖ½ð½±Àø200~1000Ôª"
      },
      "pins": [
        {
          "pin": "1",
          "pin_name": "A",
          "pin_type": "PASSIVE",
          "net": "NetD3_1"
        },
        {
          "pin": "2",
          "pin_name": "K",
          "pin_type": "PASSIVE",
          "net": "NetD3_2"
        }
      ]
    },
    {
      "designator": "JP1",
      "value": "HDR-1X2",
      "footprint": "XH2.54-LI-2P",
      "library_ref": "Header 2",
      "description": "2P½Ó²å¼þ",
      "parameters": {
        "BOMÃû³Æ": "2P½Ó²å¼þ",
        "Comment": "HDR-1X2",
        "·â×°¿âÀ´×ÔÌÔ±|Âô¼ÒID£º»Æ¾§±|Ê¯": "ÆäËûµêÆÌ¹ºÈë¾ùÎªµÁ°æ·â×°¿â£¬ÇëÁ¢¼´ÉêÇëÍË¿î£¬±¾µêÏÖ½ð½±Àø50~200Ôª",
        "ÁªÏµÂô¼Ò£¬Ãâ·Ñ²éÕÒ·â×°": "Î¨Ò»³öÊÛµêÆÌÍøÖ·https://shop463601444.taobao.com"
      },
      "pins": [
        {
          "pin": "1",
          "pin_name": "1",
          "pin_type": "PASSIVE",
          "net": "GND"
        },
        {
          "pin": "2",
          "pin_name": "2",
          "pin_type": "PASSIVE",
          "net": "VCC"
        }
      ]
    },
    {
      "designator": "JP2",
      "value": "HDR-1X2",
      "footprint": "XH2.54-LI-2P",
      "library_ref": "Header 2",
      "description": "2P½Ó²å¼þ",
      "parameters": {
        "BOMÃû³Æ": "2P½Ó²å¼þ",
        "Comment": "HDR-1X2",
        "·â×°¿âÀ´×ÔÌÔ±|Âô¼ÒID£º»Æ¾§±|Ê¯": "ÆäËûµêÆÌ¹ºÈë¾ùÎªµÁ°æ·â×°¿â£¬ÇëÁ¢¼´ÉêÇëÍË¿î£¬±¾µêÏÖ½ð½±Àø50~200Ôª",
        "ÁªÏµÂô¼Ò£¬Ãâ·Ñ²éÕÒ·â×°": "Î¨Ò»³öÊÛµêÆÌÍøÖ·https://shop463601444.taobao.com"
      },
      "pins": [
        {
          "pin": "1",
          "pin_name": "1",
          "pin_type": "PASSIVE",
          "net": "Input-"
        },
        {
          "pin": "2",
          "pin_name": "2",
          "pin_type": "PASSIVE",
          "net": "Inuput+"
        }
      ]
    },
    {
      "designator": "JP3",
      "value": "HDR-1X4",
      "footprint": "XH2.54-LI-4P",
      "library_ref": "Header 4",
      "description": "4P½Ó²å¼þ",
      "parameters": {
        "BOMÃû³Æ": "4P½Ó²å¼þ",
        "Comment": "HDR-1X4",
        "·â×°¿âÀ´×ÔÌÔ±|Âô¼ÒID£º»Æ¾§±|Ê¯": "ÆäËûµêÆÌ¹ºÈë¾ùÎªµÁ°æ·â×°¿â£¬ÇëÁ¢¼´ÉêÇëÍË¿î£¬±¾µêÏÖ½ð½±Àø50~200Ôª",
        "ÁªÏµÂô¼Ò£¬Ãâ·Ñ²éÕÒ·â×°": "Î¨Ò»³öÊÛµêÆÌÍøÖ·https://shop463601444.taobao.com"
      },
      "pins": [
        {
          "pin": "1",
          "pin_name": "1",
          "pin_type": "PASSIVE",
          "net": "ISPDAT"
        },
        {
          "pin": "2",
          "pin_name": "2",
          "pin_type": "PASSIVE",
          "net": "ISPCK"
        },
        {
          "pin": "3",
          "pin_name": "3",
          "pin_type": "PASSIVE",
          "net": "VCC"
        },
        {
          "pin": "4",
          "pin_name": "4",
          "pin_type": "PASSIVE",
          "net": "GND"
        }
      ]
    },
    {
      "designator": "JP4",
      "value": "HDR-1X4",
      "footprint": "XH2.54-LI-4P",
      "library_ref": "Header 4",
      "description": "4P½Ó²å¼þ",
      "parameters": {
        "BOMÃû³Æ": "4P½Ó²å¼þ",
        "Comment": "HDR-1X4",
        "·â×°¿âÀ´×ÔÌÔ±|Âô¼ÒID£º»Æ¾§±|Ê¯": "ÆäËûµêÆÌ¹ºÈë¾ùÎªµÁ°æ·â×°¿â£¬ÇëÁ¢¼´ÉêÇëÍË¿î£¬±¾µêÏÖ½ð½±Àø50~200Ôª",
        "ÁªÏµÂô¼Ò£¬Ãâ·Ñ²éÕÒ·â×°": "Î¨Ò»³öÊÛµêÆÌÍøÖ·https://shop463601444.taobao.com"
      },
      "pins": [
        {
          "pin": "1",
          "pin_name": "1",
          "pin_type": "PASSIVE",
          "net": "GND"
        },
        {
          "pin": "2",
          "pin_name": "2",
          "pin_type": "PASSIVE",
          "net": "TX"
        },
        {
          "pin": "3",
          "pin_name": "3",
          "pin_type": "PASSIVE",
          "net": "RX"
        },
        {
          "pin": "4",
          "pin_name": "4",
          "pin_type": "PASSIVE",
          "net": "VCC"
        }
      ]
    },
    {
      "designator": "R1",
      "value": "510",
      "footprint": "R0805_L",
      "library_ref": "R",
      "description": "ÌùÆ¬µç×è",
      "parameters": {
        "BOMÃû³Æ": "ÌùÆ¬µç×è",
        "Comment": "510",
        "ÁªÏµÏÂµ¥µêÆÌÂô¼Ò Ãâ·Ñ°ïÄã²éÕÒ·â×°": "ÁªÏµÏÂµ¥µêÆÌÂô¼Ò Ãâ·Ñ¼¼ÊõÖ§³Ö"
      },
      "pins": [
        {
          "pin": "1",
          "pin_name": "1",
          "pin_type": "PASSIVE",
          "net": "NetC1_1"
        },
        {
          "pin": "2",
          "pin_name": "2",
          "pin_type": "PASSIVE",
          "net": "NetD1_1"
        }
      ]
    },
    {
      "designator": "R2",
      "value": "100",
      "footprint": "R0805_L",
      "library_ref": "R",
      "description": "ÌùÆ¬µç×è",
      "parameters": {
        "BOMÃû³Æ": "ÌùÆ¬µç×è",
        "Comment": "100",
        "ÁªÏµÏÂµ¥µêÆÌÂô¼Ò Ãâ·Ñ°ïÄã²éÕÒ·â×°": "ÁªÏµÏÂµ¥µêÆÌÂô¼Ò Ãâ·Ñ¼¼ÊõÖ§³Ö"
      },
      "pins": [
        {
          "pin": "1",
          "pin_name": "1",
          "pin_type": "PASSIVE",
          "net": "RX"
        },
        {
          "pin": "2",
          "pin_name": "2",
          "pin_type": "PASSIVE",
          "net": "NetR2_2"
        }
      ]
    },
    {
      "designator": "R3",
      "value": "100",
      "footprint": "R0805_L",
      "library_ref": "R",
      "description": "ÌùÆ¬µç×è",
      "parameters": {
        "BOMÃû³Æ": "ÌùÆ¬µç×è",
        "Comment": "100",
        "ÁªÏµÏÂµ¥µêÆÌÂô¼Ò Ãâ·Ñ°ïÄã²éÕÒ·â×°": "ÁªÏµÏÂµ¥µêÆÌÂô¼Ò Ãâ·Ñ¼¼ÊõÖ§³Ö"
      },
      "pins": [
        {
          "pin": "1",
          "pin_name": "1",
          "pin_type": "PASSIVE",
          "net": "TX"
        },
        {
          "pin": "2",
          "pin_name": "2",
          "pin_type": "PASSIVE",
          "net": "NetR3_2"
        }
      ]
    },
    {
      "designator": "R4",
      "value": "510",
      "footprint": "R0805_L",
      "library_ref": "R",
      "description": "ÌùÆ¬µç×è",
      "parameters": {
        "BOMÃû³Æ": "ÌùÆ¬µç×è",
        "Comment": "510",
        "ÁªÏµÏÂµ¥µêÆÌÂô¼Ò Ãâ·Ñ°ïÄã²éÕÒ·â×°": "ÁªÏµÏÂµ¥µêÆÌÂô¼Ò Ãâ·Ñ¼¼ÊõÖ§³Ö"
      },
      "pins": [
        {
          "pin": "1",
          "pin_name": "1",
          "pin_type": "PASSIVE",
          "net": "NetR4_1"
        },
        {
          "pin": "2",